{
  "id": "bridge",
  "label": "Bridge",
  "prefix": "brg_",
  "description": "Many-to-many bridge table linking two entities",
  "requiresLeftEntity": true,
  "requiresRightEntity": true,
  "columns": [
    { "name": "{name}_id", "dataType": "INTEGER", "description": "Surrogate key", "isPrimaryKey": true },
    { "name": "{left}_id", "dataType": "INTEGER", "description": "FK to {left}" },
    { "name": "{right}_id", "dataType": "INTEGER", "description": "FK to {right}" },
    { "name": "dwh_inserted_at", "dataType": "TIMESTAMP_NTZ", "description": "Warehouse insert timestamp" }
  ]
}
