{
  "id": "scd2",
  "label": "SCD Type 2",
  "prefix": "dim_",
  "description": "Slowly Changing Dimension Type 2 with full history tracking",
  "columns": [
    { "name": "{name}_key", "dataType": "INTEGER", "description": "Surrogate key — one per row, so one per version of the entity", "isPrimaryKey": true, "scdType": 0 },
    { "name": "{name}_id", "dataType": "VARCHAR", "description": "Business key — repeats across the versions of one entity", "isNaturalKey": true, "scdType": 0 },
    { "name": "name", "dataType": "VARCHAR", "description": "Display name", "scdType": 2 },
    { "name": "description", "dataType": "VARCHAR", "description": "Long description", "scdType": 2 },
    { "name": "is_active", "dataType": "BOOLEAN", "description": "Active flag", "scdType": 2 },
    { "name": "scd_valid_from", "dataType": "TIMESTAMP_NTZ", "description": "SCD effective start" },
    { "name": "scd_valid_to", "dataType": "TIMESTAMP_NTZ", "description": "SCD effective end" },
    { "name": "scd_is_current", "dataType": "BOOLEAN", "description": "Current version flag" },
    { "name": "scd_hash", "dataType": "VARCHAR", "description": "Hash of tracked columns" },
    { "name": "dwh_inserted_at", "dataType": "TIMESTAMP_NTZ", "description": "Warehouse insert timestamp" },
    { "name": "dwh_updated_at", "dataType": "TIMESTAMP_NTZ", "description": "Warehouse update timestamp" }
  ]
}
